problem_set,question_id,time_segment,text,startTimestamp,endTimestamp,speaker,speaker_#,actual_segment,pred_segment,actual_question_id,pred_question_id
492.0,,1.0,"Hi, guys, we'll just wait for a couple of people to show up.",2023-03-04T16:00:48.990-08:00,2023-03-04T16:00:52.300-08:00,tutor,tutor,1,,,
,,,How's everyone doing?,2023-03-04T16:01:05.110-08:00,2023-03-04T16:01:06.600-08:00,tutor,tutor,1,,,
,,,Hey? Good! How about you?,2023-03-04T16:01:09.490-08:00,2023-03-04T16:01:10.730-08:00,student,student A,1,,,
,,,I'm. Good. I'm. Good. It's our last session together so little bit sad about that. I've I've been enjoying teaching you guys. it's really fun.,2023-03-04T16:01:11.380-08:00,2023-03-04T16:01:20.380-08:00,tutor,tutor,1,,,
,,,"Yeah. So today i'll just like over the lesson time real quick. So basically it's going to be a bit more simple. We're just going to start off with a practice test because it's a 30 min test, so it'll take a little bit longer, and then we go into, you know, looking over that practice test. If we have time you'll go over a couple of spare problems that I had. But",2023-03-04T16:01:26.970-08:00,2023-03-04T16:01:44.360-08:00,tutor,tutor,1,,,
,,,"you know, if we don't, that's okay as well. And then, after that we have 10 min where we just go over some testing tips. What to do in test day before test day, like just, I believe the night before, maybe, and anything like else you guys would like to know about the sat. You can ask me. In general.",2023-03-04T16:01:44.370-08:00,2023-03-04T16:02:00.980-08:00,tutor,tutor,1,,,
,,,"It's pretty pretty chill, obviously, this one. I just want to make sure everyone's feeling comfortable with it.",2023-03-04T16:02:01.110-08:00,2023-03-04T16:02:05.779-08:00,tutor,tutor,1,,,
,,,How are you? Can you turn your camera on?,2023-03-04T16:02:22.150-08:00,2023-03-04T16:02:24.280-08:00,tutor,tutor,1,,,
,,,"I think we should be waiting for a couple of more people, but you know we can start. They can come in as",2023-03-04T16:02:31.290-08:00,2023-03-04T16:02:36.960-08:00,tutor,tutor,1,,,
,,,"they will. So I was just explaining to people who are here a little bit earlier that the lesson plan is, we have 30 min of just going through a practice test on the final practice test. Then 30 min of going over that, and then the last 10 min will be dedicated to testing tips and",2023-03-04T16:02:37.130-08:00,2023-03-04T16:02:52.490-08:00,tutor,tutor,1,,,
,,,"what you might want to do just before testing day, the the morning of testing day, and any like general things that I I would advise you guys to do as well.",2023-03-04T16:02:52.490-08:00,2023-03-04T16:03:00.260-08:00,tutor,tutor,1,,,
,,,So what we're gonna do is start with that practice test. It's a little bit different from other sessions. Can everyone just go to the Boot Camp Series Page I'm. Going to activate the practice test. Now it should be Assessment B 3.,2023-03-04T16:03:00.280-08:00,2023-03-04T16:03:12.480-08:00,tutor,tutor,1,,,
,,,Can everyone see that?,2023-03-04T16:03:17.890-08:00,2023-03-04T16:03:19.360-08:00,tutor,tutor,1,,,
,,,"Okay, great. And this is a calculator paper. So if everyone get their calculators out, i'll set up the time until then.",2023-03-04T16:03:24.910-08:00,2023-03-04T16:03:31.790-08:00,tutor,tutor,1,,,
,,,"All right. So this is the final time. I will tell you guys. You can start so good luck, everyone. You have 30 min, and you may begin",2023-03-04T16:04:00.710-08:00,2023-03-04T16:04:09.510-08:00,tutor,tutor,1,,,
,,,about a minute left. Just make sure you check your access before submitting,2023-03-04T16:32:59.320-08:00,2023-03-04T16:33:03.140-08:00,tutor,tutor,1,,,
,,,"also with the first question. I believe that there weren't really there was some confusion with the answer choices. Don't worry, Just share the correct answer afterwards. But if you get it wrong, don't worry about it. What it's meant to say is the option. Seeing options. You have to say maximum instead of minimum",2023-03-04T16:33:03.350-08:00,2023-03-04T16:33:18.810-08:00,tutor,tutor,1,,,
,,,"alright. Time's up, and everyone just submit their answers.",2023-03-04T16:34:12.870-08:00,2023-03-04T16:34:17.070-08:00,tutor,tutor,1,,,
,,,"All right. So that test is actually quite difficult. It was one of the harder tests for sure. And so if you didn't do so, well don't worry about it. I honestly think that you know even I made a couple of mistakes because I wasn't too sure how to do it. And yeah.",2023-03-04T16:34:26.210-08:00,2023-03-04T16:34:41.950-08:00,tutor,tutor,1,,,
,,,someone mentioned that they didn't have enough time perfectly understandable. This was quite a rush test.,2023-03-04T16:34:42.050-08:00,2023-03-04T16:34:46.770-08:00,tutor,tutor,1,,,
,,,"So what we're going to do is go over it, you know. Learn from these mistakes. Remember that this is not your final test score. So",2023-03-04T16:34:46.780-08:00,2023-03-04T16:34:53.240-08:00,tutor,tutor,1,,,
,,,it's not a reflection of anything like that. So let me just share my screen. We have plenty of time to go over it,2023-03-04T16:34:53.280-08:00,2023-03-04T16:35:00.880-08:00,tutor,tutor,1,,,
,,,all right. So this is the test you guys completed.,2023-03-04T16:35:08.840-08:00,2023-03-04T16:35:11.720-08:00,tutor,tutor,1,,,
,,,"So does anyone have anything right off the bat? They want me to get started with, or Shall I? Just, you know, pick whatever I think",2023-03-04T16:35:12.360-08:00,2023-03-04T16:35:18.860-08:00,tutor,tutor,1,,,
,,,stood out.,2023-03-04T16:35:20.740-08:00,2023-03-04T16:35:21.670-08:00,tutor,tutor,1,,,
,,,Nothing is yet,2023-03-04T16:35:28.650-08:00,2023-03-04T16:35:29.900-08:00,tutor,tutor,1,,,
,23.0,1.0,Okay. So I first person just told me to go over 5.,2023-03-04T16:35:34.060-08:00,2023-03-04T16:35:38.440-08:00,tutor,tutor,2,,23.0,
,,,"So 5 is this one over here, right the one with X and Y and that table. So we're told that we have x going up as a 3, a 5 a. Whereas y is going up, we'll going down like this 0 minus a 2 minus 2, a. So telling us that we have a linear relationship. When we have a linear relationship.",2023-03-04T16:35:38.740-08:00,2023-03-04T16:35:57.940-08:00,tutor,tutor,2,,23.0,
,,,What kind of form are we looking to put our answer in?,2023-03-04T16:35:58.020-08:00,2023-03-04T16:36:01.260-08:00,tutor,tutor,2,,23.0,
,,,Does anyone know the name of the form that we need to put our answer in. If it's linear,2023-03-04T16:36:06.440-08:00,2023-03-04T16:36:10.320-08:00,tutor,tutor,2,,23.0,
,,,standard form.,2023-03-04T16:36:12.650-08:00,2023-03-04T16:36:13.960-08:00,student,student B,2,,23.0,
,,,"standard form, yes, or slope intercept form either way it works. So you know the way that it's easiest for us to do would be first making in terms of y equals Mx plus b, and then rearranging accordingly. Because why go? That myx is more useful than any of these forms. So",2023-03-04T16:36:14.690-08:00,2023-03-04T16:36:30.870-08:00,tutor,tutor,2,,23.0,
,,,how can we find the gradient? Does anyone know how we can do that?,2023-03-04T16:36:30.990-08:00,2023-03-04T16:36:33.960-08:00,tutor,tutor,2,,23.0,
,,,"So with the gradient, right, we need 2 points. Yeah, [STUDENT_6]. You were going to say something",2023-03-04T16:36:40.130-08:00,2023-03-04T16:36:43.530-08:00,tutor,tutor,2,,23.0,
,,,"you can take, you know, he said, the 2 points on the X and the Y.",2023-03-04T16:36:43.580-08:00,2023-03-04T16:36:48.560-08:00,student,student B,2,,23.0,
,,,"It's like the first 2, the negative a minus 0",2023-03-04T16:36:48.570-08:00,2023-03-04T16:36:56.190-08:00,student,student B,2,,23.0,
,,,"over 3, a minus a. and that would turn down to negative a over",2023-03-04T16:36:56.210-08:00,2023-03-04T16:37:02.370-08:00,student,student B,2,,23.0,
,,,"2, a, so these a's cancel on your left with negative one half as your gradient. So you've got M. Now how can we find B",2023-03-04T16:37:02.500-08:00,2023-03-04T16:37:14.250-08:00,tutor,tutor,2,,23.0,
,,,"anyone? Have any ideas, [STUDENT_5]? Do you have an idea of how he can find B.",2023-03-04T16:37:26.800-08:00,2023-03-04T16:37:30.030-08:00,tutor,tutor,2,,23.0,
,,,Do you plug the numbers for X and Y into the formula.,2023-03-04T16:37:33.370-08:00,2023-03-04T16:37:40.310-08:00,student,student C,2,,23.0,
,,,"Yeah, exactly. So could you walk us through that.",2023-03-04T16:37:40.410-08:00,2023-03-04T16:37:42.910-08:00,tutor,tutor,2,,23.0,
,,,Could you do? 0 equals,2023-03-04T16:37:44.980-08:00,2023-03-04T16:37:47.090-08:00,student,student C,2,,23.0,
,,,negative one half,2023-03-04T16:37:47.720-08:00,2023-03-04T16:37:49.550-08:00,student,student C,2,,23.0,
,,,a plus B.,2023-03-04T16:37:52.100-08:00,2023-03-04T16:37:54.320-08:00,student,student C,2,,23.0,
,,,Yep. Exactly. And then from there,2023-03-04T16:37:54.510-08:00,2023-03-04T16:37:57.460-08:00,tutor,tutor,2,,23.0,
,,,divide by a half the 0,2023-03-04T16:38:00.580-08:00,2023-03-04T16:38:03.250-08:00,student,student C,2,,23.0,
,,,"is B 0,",2023-03-04T16:38:03.950-08:00,2023-03-04T16:38:05.100-08:00,student,student C,2,,23.0,
,,,"So that so that that's actually a good point. You I mean you've got the first equation correct. It's just if you divide by half, remember that you also have to divide B by half. and if you range 4 B. So what would actually be easier? Just remember that you can write it in terms of a, because we do have a and our answer choices over here.",2023-03-04T16:38:06.390-08:00,2023-03-04T16:38:23.480-08:00,tutor,tutor,2,,23.0,
,,,So what you technically could do is just bring the negative halfway to one side and get B equals half a.,2023-03-04T16:38:23.570-08:00,2023-03-04T16:38:29.500-08:00,tutor,tutor,2,,23.0,
,,,"because it be, is halfway the negative halfway, plus half a just kind of that to 0. So our final equation is negative half x plus half a but good thinking.",2023-03-04T16:38:33.110-08:00,2023-03-04T16:38:43.380-08:00,tutor,tutor,2,,23.0,
,,,"So this is what we have now. Now. They've asked us to write it in a specific form in the form ax plus b, y is equal to C, where C is a, B, C, a, B, and C are all constants.",2023-03-04T16:38:43.940-08:00,2023-03-04T16:38:54.000-08:00,tutor,tutor,2,,23.0,
,,,How might we do that,2023-03-04T16:38:54.050-08:00,2023-03-04T16:38:55.360-08:00,tutor,tutor,2,,23.0,
,,,"aiden, are you? Do you have an idea of how we might do this?",2023-03-04T16:39:05.520-08:00,2023-03-04T16:39:09.150-08:00,tutor,tutor,2,,23.0,
,,,"Not really. I didn't get this question. So i'm just trying to like follow along with what you're saying. Okay, sure, no worries.",2023-03-04T16:39:11.650-08:00,2023-03-04T16:39:18.470-08:00,tutor,tutor,2,,23.0,
,,,"Well, the first thing I think we should do is because we see the add to choices. There are no fractions right, and we can see that we have the fraction over here. What we want to do is try and get rid of this fraction. So if you multiply by 2, these fractions will go away.",2023-03-04T16:39:18.920-08:00,2023-03-04T16:39:30.920-08:00,tutor,tutor,2,,23.0,
,,,"and what we'll get is because if you multiply with 2, you have to multiply every turn by 2 right? So we would get 2. Y is equal to negative x plus a just multiplying everything by 2 right there.",2023-03-04T16:39:30.960-08:00,2023-03-04T16:39:40.450-08:00,tutor,tutor,2,,23.0,
,,,"and what we can then do is, bring the X the other side to get x plus twoy",2023-03-04T16:39:40.720-08:00,2023-03-04T16:39:45.690-08:00,tutor,tutor,2,,23.0,
,,,"is equal to a, and that falls along with answered choice. A.",2023-03-04T16:39:45.750-08:00,2023-03-04T16:39:49.530-08:00,tutor,tutor,2,,23.0,
,,,"So basically whenever you're told it's a linear relationship. I would advise you straight away right down. Y equals Mx plus b. You can find the gradient using 2 points ideally, and it. Substitute one of those points back into the equation to get what the answer is for B. And then from there you can rework into whatever form that they want you to get in terms of.",2023-03-04T16:39:51.640-08:00,2023-03-04T16:40:08.470-08:00,tutor,tutor,2,,23.0,
,,,Does that make sense for everyone?,2023-03-04T16:40:11.260-08:00,2023-03-04T16:40:13.290-08:00,tutor,tutor,2,,23.0,
,,,"Great, Great.",2023-03-04T16:40:16.970-08:00,2023-03-04T16:40:18.460-08:00,tutor,tutor,2,,23.0,
,30.0,1.0,"right? Another question is Question 12, hey? Let me go. Find that one right now",2023-03-04T16:40:19.270-08:00,2023-03-04T16:40:24.110-08:00,tutor,tutor,3,,30.0,
,,,"was this 10, yeah, the quadrilateral one? Right?",2023-03-04T16:40:26.410-08:00,2023-03-04T16:40:29.150-08:00,tutor,tutor,3,,30.0,
,,,Yeah. Okay. So in quarter of actual a B C D. Above.,2023-03-04T16:40:30.120-08:00,2023-03-04T16:40:33.830-08:00,tutor,tutor,3,,30.0,
,,,Okay. So this notation over here just means that they're perpendicular.,2023-03-04T16:40:33.930-08:00,2023-03-04T16:40:37.290-08:00,tutor,tutor,3,,30.0,
,,,"So AD. And Vc. Are perpendicular, and CD. Is half of a B. So what is a measure of angle? B. So this one here is pretty deceptive. I mean we can already rule out option. D. Because, you know, this is clearly not a right angle, but you know from there. What else do you do like? How can you tell if it's a, B or C,",2023-03-04T16:40:37.640-08:00,2023-03-04T16:40:56.710-08:00,tutor,tutor,3,,30.0,
,,,But what we have to do is first label the diagram. That's my biggest advice.,2023-03-04T16:40:57.300-08:00,2023-03-04T16:41:01.350-08:00,tutor,tutor,3,,30.0,
,,,"So we're told that CD is half of a, so let's just give a B like a variable like X, for example.",2023-03-04T16:41:01.360-08:00,2023-03-04T16:41:07.140-08:00,tutor,tutor,3,,30.0,
,,,"So a B is X, then CD. By that logic would be half X.",2023-03-04T16:41:07.760-08:00,2023-03-04T16:41:12.120-08:00,tutor,tutor,3,,30.0,
,,,"And now this part will look a little bit weird, but we're going to try and get relationship in terms of triangles, just because it's easier.",2023-03-04T16:41:13.000-08:00,2023-03-04T16:41:18.730-08:00,tutor,tutor,3,,30.0,
,,,Now we know that if we drew an imaginary line down from B like that. we would also have this measure half x.,2023-03-04T16:41:18.930-08:00,2023-03-04T16:41:26.860-08:00,tutor,tutor,3,,30.0,
,,,because of this parallel lines.,2023-03-04T16:41:26.970-08:00,2023-03-04T16:41:28.870-08:00,tutor,tutor,3,,30.0,
,,,"So Top X is also represented, being, I just call it, point to M. So Bm. Is also half x. Given that CD. And Vm. Are the same link.",2023-03-04T16:41:28.920-08:00,2023-03-04T16:41:36.920-08:00,tutor,tutor,3,,30.0,
,,,From there we can actually figure out what am is. Does anyone have any idea how we can figure out what am is.,2023-03-04T16:41:37.430-08:00,2023-03-04T16:41:43.290-08:00,tutor,tutor,3,,30.0,
,,,So we have a right angle over here. Just remember that.,2023-03-04T16:41:49.600-08:00,2023-03-04T16:41:52.300-08:00,tutor,tutor,3,,30.0,
,,,"Yeah. So someone just mentioned that M. Is right? Yeah. So we have a right angle. So therefore, what can we use?",2023-03-04T16:41:54.220-08:00,2023-03-04T16:41:59.790-08:00,tutor,tutor,3,,30.0,
,,,"We can use our favorite Pythagorean theorem that we love so much. So we know that this, that this is the hypotenuse which is a B.",2023-03-04T16:42:07.670-08:00,2023-03-04T16:42:16.200-08:00,tutor,tutor,3,,30.0,
,,,So we can say that,2023-03-04T16:42:16.510-08:00,2023-03-04T16:42:18.150-08:00,tutor,tutor,3,,30.0,
,,,"am squared, which is this length over here.",2023-03-04T16:42:18.430-08:00,2023-03-04T16:42:21.280-08:00,tutor,tutor,3,,30.0,
,,,is equal to,2023-03-04T16:42:22.090-08:00,2023-03-04T16:42:23.530-08:00,tutor,tutor,3,,30.0,
,,,"X squared, which is a B, which is high part names minus one of the side length, just half x, and we square that",2023-03-04T16:42:23.900-08:00,2023-03-04T16:42:30.730-08:00,tutor,tutor,3,,30.0,
,,,"so we know am squared is equal to X squared minus a fourth X squared. which is equal to 3 over 4 x 2, and then when we square root that because we have am squared over here.",2023-03-04T16:42:31.130-08:00,2023-03-04T16:42:43.440-08:00,tutor,tutor,3,,30.0,
,,,A. M,2023-03-04T16:42:43.830-08:00,2023-03-04T16:42:44.760-08:00,tutor,tutor,3,,30.0,
,,,"just becomes the square root of 3 over 4 x squared. which is equal to root, 3 over 2 x. When you simplify that down.",2023-03-04T16:42:45.210-08:00,2023-03-04T16:42:54.300-08:00,tutor,tutor,3,,30.0,
,,,"So what we have here is X, half x and root, 3 over 2 x, making up these sidelines. and then the sat was pretty cruel with this, but they want you to be able to recognize that this is a 30, 60, 90 triangle.",2023-03-04T16:42:54.920-08:00,2023-03-04T16:43:07.020-08:00,tutor,tutor,3,,30.0,
,,,"So does everyone remember, like the whole triangles.",2023-03-04T16:43:07.170-08:00,2023-03-04T16:43:10.150-08:00,tutor,tutor,3,,30.0,
,,,I don't know if everyone remembers the key trick triangle. So what we have is one like this. which is root 3.,2023-03-04T16:43:10.250-08:00,2023-03-04T16:43:17.490-08:00,tutor,tutor,3,,30.0,
,,,"Well, x 2, 3. Basically. if the if it has those ratios.",2023-03-04T16:43:17.990-08:00,2023-03-04T16:43:22.410-08:00,tutor,tutor,3,,30.0,
,,,"maybe X or 3, then this will be",2023-03-04T16:43:22.570-08:00,2023-03-04T16:43:25.730-08:00,tutor,tutor,3,,30.0,
,,,"X over 2. And this over here would be, I think, 2 X. If i'm not.",2023-03-04T16:43:26.030-08:00,2023-03-04T16:43:32.080-08:00,tutor,tutor,3,,30.0,
,,,this would be excellent.,2023-03-04T16:43:33.700-08:00,2023-03-04T16:43:35.040-08:00,tutor,tutor,3,,30.0,
,,,"You would have x root, 3, 2, x, and x.",2023-03-04T16:43:35.730-08:00,2023-03-04T16:43:38.670-08:00,tutor,tutor,3,,30.0,
,,,"and these angles are 60 degrees 30 degrees. and there's a right angle over there, and then the other triangle is you have 1 one root, 2",2023-03-04T16:43:38.690-08:00,2023-03-04T16:43:50.540-08:00,tutor,tutor,3,,30.0,
,,,my angle 45 degrees,2023-03-04T16:43:50.970-08:00,2023-03-04T16:43:52.930-08:00,tutor,tutor,3,,30.0,
,,,and 45 degrees. These are the 2 triangles. You kind of need to be able to understand any trick relationship,2023-03-04T16:43:53.050-08:00,2023-03-04T16:43:58.860-08:00,tutor,tutor,3,,30.0,
,,,in this case. We actually have this triangle over here.,2023-03-04T16:43:59.020-08:00,2023-03-04T16:44:03.300-08:00,tutor,tutor,3,,30.0,
,,,and if we look at it. I'll just explain why. So this here is root 3 over 2. X. What we're basically assuming,2023-03-04T16:44:03.440-08:00,2023-03-04T16:44:09.530-08:00,tutor,tutor,3,,30.0,
,,,is that the value of like x. This ratio is divided by 2. So basically you can see every side like over here is half of every sign length over here.,2023-03-04T16:44:09.560-08:00,2023-03-04T16:44:19.150-08:00,tutor,tutor,3,,30.0,
,,,but it doesn't matter if it's hot. The point is this: since all of them are half the angles remain the same. They are similar triangles.,2023-03-04T16:44:20.000-08:00,2023-03-04T16:44:26.240-08:00,tutor,tutor,3,,30.0,
,,,"So what we see over here is, we just have to compare the angles of this triangle with the angles in this triangle. In this case we see that M. Is the right angle.",2023-03-04T16:44:26.670-08:00,2023-03-04T16:44:35.530-08:00,tutor,tutor,3,,30.0,
,,,"and we want the angle between the X and 2 X, or in our case with this triangle between the half X and X. We want this angle over here temporarily.",2023-03-04T16:44:35.620-08:00,2023-03-04T16:44:43.900-08:00,tutor,tutor,3,,30.0,
,,,and what we get is 60 degree angle.,2023-03-04T16:44:44.130-08:00,2023-03-04T16:44:46.560-08:00,tutor,tutor,3,,30.0,
,,,But remember that they're asking for angle. Be so that to be the entire thing.,2023-03-04T16:44:46.790-08:00,2023-03-04T16:44:50.400-08:00,tutor,tutor,3,,30.0,
,,,"But remember that this angle Mbc. Over here is a ri angle, because we've just made a rect. We've just made a square. so therefore it will be 60 degrees, plus 90 degrees, which is 150 degrees.",2023-03-04T16:44:50.430-08:00,2023-03-04T16:45:01.170-08:00,tutor,tutor,3,,30.0,
,,,That was a complicated explanation. Does anyone want me to like clarify anything on that.,2023-03-04T16:45:03.080-08:00,2023-03-04T16:45:07.180-08:00,tutor,tutor,3,,30.0,
,,,"hey? So most people seem pretty okay, with it.",2023-03-04T16:45:15.010-08:00,2023-03-04T16:45:18.900-08:00,tutor,tutor,3,,30.0,
,,,Okay.,2023-03-04T16:45:20.500-08:00,2023-03-04T16:45:21.180-08:00,tutor,tutor,3,,30.0,
,,,anyone else have any other questions. They'd like me to go over,2023-03-04T16:45:22.320-08:00,2023-03-04T16:45:25.220-08:00,tutor,tutor,3,,30.0,
,34.0,1.0,34. Okay.,2023-03-04T16:45:27.090-08:00,2023-03-04T16:45:28.990-08:00,tutor,tutor,4,,34.0,
,,,"this one over here. I believe the relationship between X and y can be written as y equals. Mx. Where m is a constant, if y equals 17 when x is a what is the value of y when X is to a okay, so basically we're told it's a linear relationship. So as we increase",2023-03-04T16:45:31.590-08:00,2023-03-04T16:45:48.370-08:00,tutor,tutor,4,,34.0,
,,,"X by a certain amount, why should increase by a set amount to.",2023-03-04T16:45:48.370-08:00,2023-03-04T16:45:51.990-08:00,tutor,tutor,4,,34.0,
,,,"So we know it's in the form y equals Mx, as they said",2023-03-04T16:45:52.070-08:00,2023-03-04T16:45:55.560-08:00,tutor,tutor,4,,34.0,
,,,"so. If we take this first piece of information, where, why is 17. When X is a, we can say that 17 is equal to Ma, because we just substitute these points in now they're asking for the value of Why, when x is to a so if we just write that down, we're asking for what y is when x is to a so to a times m is to Ma.",2023-03-04T16:45:56.340-08:00,2023-03-04T16:46:15.740-08:00,tutor,tutor,4,,34.0,
,,,"So if we know that ma is 17, we can just substitute Ma into",2023-03-04T16:46:16.550-08:00,2023-03-04T16:46:20.830-08:00,tutor,tutor,4,,34.0,
,,,"the Ima in this equation. So you get why is 2 times 17,",2023-03-04T16:46:21.010-08:00,2023-03-04T16:46:25.500-08:00,tutor,tutor,4,,34.0,
,,,"4, 34.",2023-03-04T16:46:25.580-08:00,2023-03-04T16:46:27.230-08:00,tutor,tutor,4,,34.0,
,,,"So with that one it's just about it. You can also recognize that because you've increased X by double tightly. Why should also double, since there's no y intercept here.",2023-03-04T16:46:30.730-08:00,2023-03-04T16:46:40.110-08:00,tutor,tutor,4,,34.0,
,,,Does that make sense?,2023-03-04T16:46:43.290-08:00,2023-03-04T16:46:44.740-08:00,tutor,tutor,4,,34.0,
,,,Okay? Great? It's quite funny as well because question 34 has answered 34.,2023-03-04T16:46:48.590-08:00,2023-03-04T16:46:53.320-08:00,tutor,tutor,4,,34.0,
,32.0,1.0,"Any other questions okay, 14,",2023-03-04T16:46:53.610-08:00,2023-03-04T16:46:56.770-08:00,tutor,tutor,5,,32.0,
,,,"14. Is this one here, right? Or is it 14? Yeah. Okay. So in the triangle above a is equal to 34. What is the value of B plus C. All right. So this relies on our knowledge of triangles. Does anyone know what the angles of a triangle have to add up to",2023-03-04T16:46:57.760-08:00,2023-03-04T16:47:13.800-08:00,tutor,tutor,5,,32.0,
,,,180,2023-03-04T16:47:14.700-08:00,2023-03-04T16:47:16.310-08:00,student,student A,5,,32.0,
,,,correct. So all the interior angles of a triangle have to be 180. So by that logic you can say that a plus b plus C has to go 180.,2023-03-04T16:47:16.560-08:00,2023-03-04T16:47:26.330-08:00,tutor,tutor,5,,32.0,
,,,Where can we go from here? So we to what a is. So what should we do.,2023-03-04T16:47:26.630-08:00,2023-03-04T16:47:30.670-08:00,tutor,tutor,5,,32.0,
,,,You would just subtract 34 from the one.,2023-03-04T16:47:36.260-08:00,2023-03-04T16:47:39.850-08:00,student,student A,5,,32.0,
,,,"Exactly. So we have a on this side. We're towards 34. So if we just bring it to the other side we get. So we have 34, plus b plus C was 180, and aid, and as you said, we can say, that B. Plus c. Is equal to 180, minus 34, or 146",2023-03-04T16:47:40.620-08:00,2023-03-04T16:47:55.240-08:00,tutor,tutor,5,,32.0,
,,,"and if we look at the question they're asking us just the B plus, c. So we don't even need to do anything more. The answer is just 146.",2023-03-04T16:47:55.450-08:00,2023-03-04T16:48:01.860-08:00,tutor,tutor,5,,32.0,
,,,"I was a little bit confused, because I thought that the a equals 34 was in reference to the side one. If there was no degree over the",2023-03-04T16:48:06.380-08:00,2023-03-04T16:48:14.530-08:00,student,student B,5,,32.0,
,,,"Oh, you didn't think it was about the degrees.",2023-03-04T16:48:14.970-08:00,2023-03-04T16:48:17.290-08:00,tutor,tutor,5,,32.0,
,,,"Okay, yeah, no, Don't. Worry about that. Just realize, also that they haven't actually labeled the triangle with side lengths. They just labeled the Angles, and as you can see, like you know, take into account the fact that it's Lowercase a, and they've asked, and they put lower case in the question, so you can correspond them. But yeah, it can be a little confusing",2023-03-04T16:48:17.420-08:00,2023-03-04T16:48:34.360-08:00,tutor,tutor,5,,32.0,
,,1.0,any other questions we like to go over.,2023-03-04T16:48:36.320-08:00,2023-03-04T16:48:38.400-08:00,tutor,tutor,6,,,
,,,Let me just go through and see if there's anything else?,2023-03-04T16:48:46.730-08:00,2023-03-04T16:48:49.350-08:00,tutor,tutor,6,,,
,,,Question 9. Did everyone feel okay? About,2023-03-04T16:48:52.040-08:00,2023-03-04T16:48:54.490-08:00,tutor,tutor,6,,,
,,,"Okay. 37, 38 just given. Let me just go for that",2023-03-04T16:48:59.270-08:00,2023-03-04T16:49:02.910-08:00,tutor,tutor,6,,,
,37.0,1.0,right. Yeah. This one was about the conversions. All right. So the Peregrine falcon,2023-03-04T16:49:03.030-08:00,2023-03-04T16:49:08.510-08:00,tutor,tutor,7,,37.0,
,,,wait. I've just got another message.,2023-03-04T16:49:08.660-08:00,2023-03-04T16:49:11.220-08:00,tutor,tutor,7,,37.0,
,,,Okay.,2023-03-04T16:49:14.310-08:00,2023-03-04T16:49:15.170-08:00,tutor,tutor,7,,37.0,
