problem_set,question_id,time_segment,text,startTimestamp,endTimestamp,speaker,speaker_#,actual_segment,pred_segment,actual_question_id,pred_question_id
,,,But yeah.,2023-02-19T19:48:55.980+00:00,2023-02-19T19:48:57.300+00:00,tutor,tutor,10,,36.0,
,,,"that's how this home works. So if you guys want to like, make a note of it, or something to like on a post, it just like slap on your forehead. I'm just getting, or like slapped it on the little",2023-02-19T19:48:57.350+00:00,2023-02-19T19:49:08.520+00:00,tutor,tutor,10,,36.0,
,,,"test sheet. You guys made it printed out for the marshmallow. Test it, or just like, put in your room somewhere. Just remember that the system equations has no solution",2023-02-19T19:49:10.359+00:00,2023-02-19T19:49:19.779+00:00,tutor,tutor,10,,36.0,
,,,when it has the same slope.,2023-02-19T19:49:19.970+00:00,2023-02-19T19:49:21.439+00:00,tutor,tutor,10,,36.0,
,,,Do you guys understand how that works.,2023-02-19T19:49:22.060+00:00,2023-02-19T19:49:23.590+00:00,tutor,tutor,10,,36.0,
,,,"Okay. So no questions on that one. If you guys need any further explanation, you guys can ask me afterwards that's your queue number 35,",2023-02-19T19:49:36.200+00:00,2023-02-19T19:49:47.399+00:00,tutor,tutor,10,,36.0,
,35.0,1.0,37 38 number 35.,2023-02-19T19:49:47.500+00:00,2023-02-19T19:49:51.160+00:00,tutor,tutor,11,,35.0,
,,,"Josella would owe $15,500 in taxes each year if She were not eligible for any tax deductions this year. just Josila is eligible for tax inductions that reduce the amount of fact that she owes by $2,325.",2023-02-19T19:49:51.479+00:00,2023-02-19T19:50:08.600+00:00,tutor,tutor,11,,35.0,
,,,If these tax deductions reduce tag reduce the taxes. Just sell up OS this year by d percent. What is the value of D.,2023-02-19T19:50:08.700+00:00,2023-02-19T19:50:17.760+00:00,tutor,tutor,11,,35.0,
,,,"So before we even like tech this problem, Never type any symbols into your answers, because usually just say, like deeper sense, what is the",2023-02-19T19:50:17.819+00:00,2023-02-19T19:50:28.220+00:00,tutor,tutor,11,,35.0,
,,,"that's usually how it works. But yeah, just be careful with typing symbols, and that's going to give you an option on the but",2023-02-19T19:50:28.950+00:00,2023-02-19T19:50:35.050+00:00,tutor,tutor,11,,35.0,
,,,where we on schoolhouse just type the actual answer.,2023-02-19T19:50:35.160+00:00,2023-02-19T19:50:38.939+00:00,tutor,tutor,11,,35.0,
,,,Yeah.,2023-02-19T19:50:40.680+00:00,2023-02-19T19:50:41.250+00:00,tutor,tutor,11,,35.0,
,,,"So $15,500",2023-02-19T19:50:42.450+00:00,2023-02-19T19:50:46.820+00:00,tutor,tutor,11,,35.0,
,,,"and then decreases by 2,025. So to solve this problem, what we're going to do",2023-02-19T19:50:47.030+00:00,2023-02-19T19:50:53.560+00:00,tutor,tutor,11,,35.0,
,,,is,2023-02-19T19:50:55.050+00:00,2023-02-19T19:50:56.290+00:00,tutor,tutor,11,,35.0,
,,,"find out what 2,325",2023-02-19T19:50:56.550+00:00,2023-02-19T19:51:00.940+00:00,tutor,tutor,11,,35.0,
,,,"divided by Okay, that's",2023-02-19T19:51:01.890+00:00,2023-02-19T19:51:04.720+00:00,tutor,tutor,11,,35.0,
,,,"I'm. I'm. I'm. I'm, I'm. I'm. I'm",2023-02-19T19:51:06.060+00:00,2023-02-19T19:51:08.840+00:00,tutor,tutor,11,,35.0,
,,,"we're gonna find out what? 2,325 is",2023-02-19T19:51:10.580+00:00,2023-02-19T19:51:14.020+00:00,tutor,tutor,11,,35.0,
,,,"divided by what is 15,500,",2023-02-19T19:51:14.070+00:00,2023-02-19T19:51:18.300+00:00,tutor,tutor,11,,35.0,
,,,it and it says.,2023-02-19T19:51:21.790+00:00,2023-02-19T19:51:23.910+00:00,tutor,tutor,11,,35.0,
,,,reduce the tax that you sell it owes this year by the percent we're trying to find the percentage,2023-02-19T19:51:24.820+00:00,2023-02-19T19:51:29.020+00:00,tutor,tutor,11,,35.0,
,,,we go here.,2023-02-19T19:51:29.700+00:00,2023-02-19T19:51:31.290+00:00,tutor,tutor,11,,35.0,
,,,"It's going to keep all 2,000 years. 5,",2023-02-19T19:51:32.290+00:00,2023-02-19T19:51:35.490+00:00,tutor,tutor,11,,35.0,
,,,"bye bye. 15,500.",2023-02-19T19:51:35.730+00:00,2023-02-19T19:51:39.160+00:00,tutor,tutor,11,,35.0,
,,,"That gives us 0 point 1 5,",2023-02-19T19:51:40.530+00:00,2023-02-19T19:51:42.780+00:00,tutor,tutor,11,,35.0,
,,,But I don't think we're done Yet what we're gonna have to do afterwards is to,2023-02-19T19:51:43.540+00:00,2023-02-19T19:51:50.240+00:00,tutor,tutor,11,,35.0,
,,,"15,500 times point 1 5 to see if that's actually correct, answer to your answer.",2023-02-19T19:51:50.490+00:00,2023-02-19T19:51:56.670+00:00,tutor,tutor,11,,35.0,
,,,"And it is because whenever you multiply 50,500 by point, on 5, you should get 2,325",2023-02-19T19:51:56.780+00:00,2023-02-19T19:52:03.610+00:00,tutor,tutor,11,,35.0,
,,,just like a free type,2023-02-19T19:52:03.860+00:00,2023-02-19T19:52:05.440+00:00,tutor,tutor,11,,35.0,
,,,it here.,2023-02-19T19:52:06.700+00:00,2023-02-19T19:52:08.030+00:00,tutor,tutor,11,,35.0,
,,,"2,025",2023-02-19T19:52:10.690+00:00,2023-02-19T19:52:12.860+00:00,tutor,tutor,11,,35.0,
,,,"equals 0 point, 1 5 times",2023-02-19T19:52:13.360+00:00,2023-02-19T19:52:17.130+00:00,tutor,tutor,11,,35.0,
,,,"8,500.",2023-02-19T19:52:18.450+00:00,2023-02-19T19:52:19.940+00:00,tutor,tutor,11,,35.0,
,,,So it's 15 you know. Let's go see that in a second,2023-02-19T19:52:22.990+00:00,2023-02-19T19:52:26.580+00:00,tutor,tutor,11,,35.0,
,,,the correct answer.,2023-02-19T19:52:27.760+00:00,2023-02-19T19:52:29.460+00:00,tutor,tutor,11,,35.0,
,,,You need one moment to find the answer. Your key.,2023-02-19T19:52:36.230+00:00,2023-02-19T19:52:39.770+00:00,tutor,tutor,11,,35.0,
,,,First question.,2023-02-19T19:52:45.520+00:00,2023-02-19T19:52:46.890+00:00,tutor,tutor,11,,35.0,
,,,15. Yeah. Here you go.,2023-02-19T19:52:53.490+00:00,2023-02-19T19:52:55.070+00:00,tutor,tutor,11,,35.0,
,,,35 it's. 15.,2023-02-19T19:52:55.180+00:00,2023-02-19T19:52:56.540+00:00,tutor,tutor,11,,35.0,
,,,"Yes, that would be wrong on the sat. You would just have to like 15 if you type in the symbol I mean it doesn't give you an option to have been simple. But if you were to somehow it would be kind of incorrect. Yes.",2023-02-19T19:52:59.910+00:00,2023-02-19T19:53:13.380+00:00,tutor,tutor,11,,35.0,
,,,"so just type in the number. and then make sure if it asks you in decimal form type in 0 point, 1 5 instead of 15 0r 15. In this case. All right, let's move on to",2023-02-19T19:53:14.290+00:00,2023-02-19T19:53:25.720+00:00,tutor,tutor,11,,35.0,
,37.0,1.0,"number 37,",2023-02-19T19:53:25.880+00:00,2023-02-19T19:53:28.960+00:00,tutor,tutor,12,,37.0,
,,,based on the information given in how much greater in millions,2023-02-19T19:53:29.280+00:00,2023-02-19T19:53:33.700+00:00,tutor,tutor,12,,37.0,
,,,"was the media number of international tourists arrivals to the top line to assist nation in 2,013. Then the media number in 2,012 to the near 10 million.",2023-02-19T19:53:33.850+00:00,2023-02-19T19:53:42.590+00:00,tutor,tutor,12,,37.0,
,,,Okay. So first we have to find the meetings here.,2023-02-19T19:53:43.590+00:00,2023-02-19T19:53:46.590+00:00,tutor,tutor,12,,37.0,
,,,so there are,2023-02-19T19:53:46.630+00:00,2023-02-19T19:53:48.500+00:00,tutor,tutor,12,,37.0,
,,,"9 to assess nations in both 2,012 and 2,013.",2023-02-19T19:53:50.150+00:00,2023-02-19T19:53:54.090+00:00,tutor,tutor,12,,37.0,
,,,"So we would count up 1 2 3 4, and then count down 1 2 3 4 to find our Median here for 2,000, and 12 to be 46.4, and these are also an order.",2023-02-19T19:53:54.140+00:00,2023-02-19T19:54:08.040+00:00,tutor,tutor,12,,37.0,
,,,"24.7 is less than 26, point 3, and s0 0n, and s0 0n, because it has to be in the order from least to greatest, to find the medium.",2023-02-19T19:54:08.040+00:00,2023-02-19T19:54:14.690+00:00,tutor,tutor,12,,37.0,
,,,"If it's not like that, you guys didn't have to type it or like red it on the side. But the actual order is. So you have 24.7 t0 26.3 t0 30, point 4 t0 35.7 point 6 by 4 57.7 57.5. So, even though 57.7 is greater than 57. Point 5. If you guys just like",2023-02-19T19:54:14.800+00:00,2023-02-19T19:54:34.610+00:00,tutor,tutor,12,,37.0,
,,,flip it around it doesn't really affect anything.,2023-02-19T19:54:34.820+00:00,2023-02-19T19:54:38.080+00:00,tutor,tutor,12,,37.0,
,,,"and then 66.7 8 3. We g0 0ver here 28, point 4 3 2.2 31.5. We just flip those. Nothing really changes, and then 37. Point 8 47.7 56.7 0r just 60.7,",2023-02-19T19:54:38.740+00:00,2023-02-19T19:54:54.280+00:00,tutor,tutor,12,,37.0,
,,,"6 9, plan, and s0 0n so right here is the Median.",2023-02-19T19:54:54.290+00:00,2023-02-19T19:54:58.710+00:00,tutor,tutor,12,,37.0,
,,,S0 47.7 minus 46. Point 4.,2023-02-19T19:55:00.070+00:00,2023-02-19T19:55:03.720+00:00,tutor,tutor,12,,37.0,
,,,"What is that case? Type in the chat, please.",2023-02-19T19:55:03.730+00:00,2023-02-19T19:55:07.380+00:00,tutor,tutor,12,,37.0,
,,,You guys can DM: me? So nobody else is your answer.,2023-02-19T19:55:08.380+00:00,2023-02-19T19:55:10.990+00:00,tutor,tutor,12,,37.0,
,,,Okay?,2023-02-19T19:55:19.090+00:00,2023-02-19T19:55:19.670+00:00,tutor,tutor,12,,37.0,
,,,So the correct answer is 1.3. Thank you. No up. And that is because 47.7 minus 46.4 is 1.3. The question asks,2023-02-19T19:55:20.230+00:00,2023-02-19T19:55:30.700+00:00,tutor,tutor,12,,37.0,
,,,"right here Wasn't Median number of international tourists and rivals to the top, 9 t0 2013, and the media number in 2,012 t0 10 0r 7 million. So how much greater?",2023-02-19T19:55:30.700+00:00,2023-02-19T19:55:40.790+00:00,tutor,tutor,12,,37.0,
,,,"1.3 million greater, and it says in billions we just typed in 1.3.",2023-02-19T19:55:40.900+00:00,2023-02-19T19:55:45.520+00:00,tutor,tutor,12,,37.0,
,,,So that's how that works.,2023-02-19T19:55:45.980+00:00,2023-02-19T19:55:47.320+00:00,tutor,tutor,12,,37.0,
,38.0,1.0,"The number of international tourist arrivals in Russia in 2,012 was 13.5% greater than in 2,011. The number of international tourist rivals in Russia was K. 1 million more in 2,012 than in 2,011. What is the value of K. In your signature? Give me just 1 s here.",2023-02-19T19:55:49.640+00:00,2023-02-19T19:56:07.300+00:00,tutor,tutor,13,,38.0,
,,,Okay.,2023-02-19T19:56:08.510+00:00,2023-02-19T19:56:09.310+00:00,tutor,tutor,13,,38.0,
,,,"So we're gonna do. First is figure out what 2,012 value was just 24.7, and we know that in 2,011",2023-02-19T19:56:10.410+00:00,2023-02-19T19:56:22.050+00:00,tutor,tutor,13,,38.0,
,,,"it was 13.5%. Less. So how we're going to do this is actually the by 24.7 by 1.1 3 5,",2023-02-19T19:56:22.150+00:00,2023-02-19T19:56:32.530+00:00,tutor,tutor,13,,38.0,
,,,"24, point 7 3 by 1.1 3 5 0kay.",2023-02-19T19:56:38.380+00:00,2023-02-19T19:56:44.190+00:00,tutor,tutor,13,,38.0,
,,,Even noticed that.,2023-02-19T19:56:45.140+00:00,2023-02-19T19:56:46.300+00:00,tutor,tutor,13,,38.0,
,,,The reason why i'm doing this is because you wouldn't,2023-02-19T19:56:47.880+00:00,2023-02-19T19:56:52.010+00:00,tutor,tutor,13,,38.0,
,,,"multiply 24, point 7,",2023-02-19T19:56:52.390+00:00,2023-02-19T19:56:55.090+00:00,tutor,tutor,13,,38.0,
,,,fine 13.5%. Because if we do that,2023-02-19T19:56:55.220+00:00,2023-02-19T19:56:58.760+00:00,tutor,tutor,13,,38.0,
,,,"1 1 3 5,",2023-02-19T19:57:00.100+00:00,2023-02-19T19:57:01.490+00:00,tutor,tutor,13,,38.0,
,,,I mean it still gives you the correct answer.,2023-02-19T19:57:03.010+00:00,2023-02-19T19:57:06.570+00:00,tutor,tutor,13,,38.0,
,,,But that's not really a sure by way of doing this.,2023-02-19T19:57:06.740+00:00,2023-02-19T19:57:10.140+00:00,tutor,tutor,13,,38.0,
,,,"because sometimes it's incorrect, and that's what I have done in the past, and it gives the incorrect answer",2023-02-19T19:57:11.190+00:00,2023-02-19T19:57:16.130+00:00,tutor,tutor,13,,38.0,
,,,"s0 24.7, about 1.1 3 5 is. I think this is like 21 point something",2023-02-19T19:57:16.250+00:00,2023-02-19T19:57:24.900+00:00,tutor,tutor,13,,38.0,
,,,21.8.,2023-02-19T19:57:28.920+00:00,2023-02-19T19:57:30.250+00:00,tutor,tutor,13,,38.0,
,,,"Okay. So then, this is not our final answer. Final answer is actually 21 24.7 minus 21.",2023-02-19T19:57:33.160+00:00,2023-02-19T19:57:44.340+00:00,tutor,tutor,13,,38.0,
,,,"It says the number of international tourist arrivals in Russia was k 1 million more in 2,012 than in 2,011.",2023-02-19T19:57:44.400+00:00,2023-02-19T19:57:51.420+00:00,tutor,tutor,13,,38.0,
,,,So just d0 24.7 minus 21.8.,2023-02-19T19:57:53.810+00:00,2023-02-19T19:57:57.640+00:00,tutor,tutor,13,,38.0,
,,,Let's go. Check this out real quick.,2023-02-19T19:57:58.800+00:00,2023-02-19T19:58:00.280+00:00,tutor,tutor,13,,38.0,
,,,"Okay. 4.7,",2023-02-19T19:58:03.970+00:00,2023-02-19T19:58:06.290+00:00,tutor,tutor,13,,38.0,
,,,minus 21 0ne. 8,2023-02-19T19:58:06.330+00:00,2023-02-19T19:58:09.830+00:00,tutor,tutor,13,,38.0,
,,,"equals 2.9, which is about 3,",2023-02-19T19:58:10.140+00:00,2023-02-19T19:58:16.520+00:00,tutor,tutor,13,,38.0,
,,,"and that's the correct answer. Let's see if that's correct. Yes, and our last one was also right in Point 3.",2023-02-19T19:58:17.090+00:00,2023-02-19T19:58:24.220+00:00,tutor,tutor,13,,38.0,
,,,"So do you guys understand how that works, or anybody else like a explanation on that one?",2023-02-19T19:58:24.550+00:00,2023-02-19T19:58:30.490+00:00,tutor,tutor,13,,38.0,
,,,"Why, why was where did you have what I mean. Where'd you get one for? 1 3 5,",2023-02-19T19:58:36.170+00:00,2023-02-19T19:58:40.840+00:00,student,student A,13,,38.0,
,,,1.1 3 5. So good question.,2023-02-19T19:58:41.220+00:00,2023-02-19T19:58:43.940+00:00,tutor,tutor,13,,38.0,
,,,Let's go. Look at the answer. 13.5% creator,2023-02-19T19:58:45.020+00:00,2023-02-19T19:58:49.560+00:00,tutor,tutor,13,,38.0,
,,,"than X or y equals 1.1 3 5, x. So if you plug in the",2023-02-19T19:58:49.990+00:00,2023-02-19T19:58:56.770+00:00,tutor,tutor,13,,38.0,
,,,okay,2023-02-19T19:58:58.080+00:00,2023-02-19T19:58:58.720+00:00,tutor,tutor,13,,38.0,
,,,"numbers here you do. Y equals 1.1 3 5,",2023-02-19T19:58:59.140+00:00,2023-02-19T19:59:04.340+00:00,tutor,tutor,13,,38.0,
,,,"x, and you plug in 24.7, which is the new value, and you multiply the original value by 1.135, which is one plus the percentage",2023-02-19T19:59:04.650+00:00,2023-02-19T19:59:18.160+00:00,tutor,tutor,13,,38.0,
,,,"percentage of decimal form is 0 point, 1 3 5, s0 0ne plus 0, point 1 3 5 is 1.1 3 5.",2023-02-19T19:59:18.160+00:00,2023-02-19T19:59:25.900+00:00,tutor,tutor,13,,38.0,
,,,So then you get 24.7 equals,2023-02-19T19:59:26.280+00:00,2023-02-19T19:59:29.700+00:00,tutor,tutor,13,,38.0,
,,,"1.1 3 5 times x, which is what you're trying to find",2023-02-19T19:59:29.850+00:00,2023-02-19T19:59:34.360+00:00,tutor,tutor,13,,38.0,
,,,"the 2,011 value. Then you divide 24.7 by 1.1 3 5, and then that's like 21.8, like we said.",2023-02-19T19:59:34.390+00:00,2023-02-19T19:59:44.120+00:00,tutor,tutor,13,,38.0,
,,,and,2023-02-19T19:59:44.800+00:00,2023-02-19T19:59:45.450+00:00,tutor,tutor,13,,38.0,
,,,you to,2023-02-19T19:59:45.500+00:00,2023-02-19T19:59:46.580+00:00,tutor,tutor,13,,38.0,
,,,"24. Point 7 9 is 21.8. To get your answer of 3, and it says round the 10 years integer and integer is a whole number.",2023-02-19T19:59:46.720+00:00,2023-02-19T19:59:56.100+00:00,tutor,tutor,13,,38.0,
,,,So give me an explanation of that one. Or would you like me to cover it? Yeah.,2023-02-19T19:59:56.980+00:00,2023-02-19T20:00:00.380+00:00,tutor,tutor,13,,38.0,
,,,It's okay. Thank you.,2023-02-19T20:00:06.420+00:00,2023-02-19T20:00:07.630+00:00,student,student A,13,,38.0,
,,,Sorry if that was a cool shoddy. But I will explain if you need to. So,2023-02-19T20:00:08.830+00:00,2023-02-19T20:00:16.210+00:00,tutor,tutor,13,,38.0,
,,,going to the next problem.,2023-02-19T20:00:17.980+00:00,2023-02-19T20:00:19.540+00:00,tutor,tutor,13,,38.0,
,25.0,1.0,It's going to review number one.,2023-02-19T20:00:24.540+00:00,2023-02-19T20:00:26.130+00:00,tutor,tutor,14,,25.0,
,,,Okay. So this is a trig. Identity. I believe.,2023-02-19T20:00:30.430+00:00,2023-02-19T20:00:34.210+00:00,tutor,tutor,14,,25.0,
,,,"if sign of X degrees equals a which of the following must be true for all values. X. So sign and cosine cosine and sign are just a shift of each other, and the shift is pi over 2 radians or 90 degrees.",2023-02-19T20:00:34.360+00:00,2023-02-19T20:00:49.660+00:00,tutor,tutor,14,,25.0,
,,,"Oh, see you, [STUDENT_10], i'll see you next week. Thank you for coming today.",2023-02-19T20:00:49.730+00:00,2023-02-19T20:00:54.190+00:00,tutor,tutor,14,,25.0,
,,,So if sign of X degrees equals a which the following must be true for all.,2023-02-19T20:00:55.150+00:00,2023-02-19T20:01:01.210+00:00,tutor,tutor,14,,25.0,
,,,So here,2023-02-19T20:01:02.070+00:00,2023-02-19T20:01:03.460+00:00,tutor,tutor,14,,25.0,
,,,"the correct answer is, c. And you can actually",2023-02-19T20:01:03.530+00:00,2023-02-19T20:01:07.270+00:00,tutor,tutor,14,,25.0,
,,,"log in values into your top clear. That's how I actually solve this one when I was taking this practice test. So let's take a value sign of 30 degrees, for example.",2023-02-19T20:01:07.390+00:00,2023-02-19T20:01:16.890+00:00,tutor,tutor,14,,25.0,
,,,that's one half.,2023-02-19T20:01:17.450+00:00,2023-02-19T20:01:19.100+00:00,tutor,tutor,14,,25.0,
,,,So let's just write that down to make sure that.,2023-02-19T20:01:20.170+00:00,2023-02-19T20:01:23.530+00:00,tutor,tutor,14,,25.0,
,,,"Okay, that's not the best in writing you just",2023-02-19T20:01:26.360+00:00,2023-02-19T20:01:29.590+00:00,tutor,tutor,14,,25.0,
,,,this.,2023-02-19T20:01:31.040+00:00,2023-02-19T20:01:32.010+00:00,tutor,tutor,14,,25.0,
,,,"Yes, it is okay. If you leave, though, we will g0 0ver some more problems next week on Saturday, in case you miss anything today. Thank you for coming today.",2023-02-19T20:01:36.110+00:00,2023-02-19T20:01:46.320+00:00,tutor,tutor,14,,25.0,
,,,I 30 degrees equals one half. and that's like a little 30 60 90 triangle you guys can draw.,2023-02-19T20:01:46.930+00:00,2023-02-19T20:01:52.960+00:00,tutor,tutor,14,,25.0,
,,,I actually show you that guys I did that.,2023-02-19T20:01:54.370+00:00,2023-02-19T20:01:56.060+00:00,tutor,tutor,14,,25.0,
,,,"So this let's just pretend it's the 36, and I think it's not the best thing ever. Oh, wow.",2023-02-19T20:01:57.900+00:00,2023-02-19T20:02:04.690+00:00,tutor,tutor,14,,25.0,
,,,"okay, that's not what 36 90 looks like. But this is what we're gonna have to work with. I'm sorry about that guys.",2023-02-19T20:02:04.740+00:00,2023-02-19T20:02:10.530+00:00,tutor,tutor,14,,25.0,
,,,So,2023-02-19T20:02:11.440+00:00,2023-02-19T20:02:12.650+00:00,tutor,tutor,14,,25.0,
,,,this is the 30 decree.,2023-02-19T20:02:13.910+00:00,2023-02-19T20:02:16.250+00:00,tutor,tutor,14,,25.0,
,,,This is the,2023-02-19T20:02:17.060+00:00,2023-02-19T20:02:18.310+00:00,tutor,tutor,14,,25.0,
,,,"what we hope to be the 98, and then this is the 63.",2023-02-19T20:02:19.930+00:00,2023-02-19T20:02:26.860+00:00,tutor,tutor,14,,25.0,
,,,Let me try something else here.,2023-02-19T20:02:28.370+00:00,2023-02-19T20:02:30.700+00:00,tutor,tutor,14,,25.0,
,,,"I don't want this one. We watch kids simple means, okay.",2023-02-19T20:02:35.940+00:00,2023-02-19T20:02:41.150+00:00,tutor,tutor,14,,25.0,
,,,So here's the first line.,2023-02-19T20:02:43.810+00:00,2023-02-19T20:02:46.500+00:00,tutor,tutor,14,,25.0,
,,,"We're gonna according to like this. Okay, now, that's looking more like a triangle guys.",2023-02-19T20:02:48.450+00:00,2023-02-19T20:02:53.530+00:00,tutor,tutor,14,,25.0,
,,,Okay. I grab this last one here,2023-02-19T20:02:56.140+00:00,2023-02-19T20:02:58.810+00:00,tutor,tutor,14,,25.0,
,,,and then move it like this.,2023-02-19T20:03:00.620+00:00,2023-02-19T20:03:02.560+00:00,tutor,tutor,14,,25.0,
,,,I mean that's close enough t0 9 degrees. But you guys have to,2023-02-19T20:03:05.130+00:00,2023-02-19T20:03:08.830+00:00,tutor,tutor,14,,25.0,
,,,bear with me here with this one. Okay. So you know that this one here,2023-02-19T20:03:10.060+00:00,2023-02-19T20:03:17.790+00:00,tutor,tutor,14,,25.0,
,,,is 30 degrees,2023-02-19T20:03:18.210+00:00,2023-02-19T20:03:20.130+00:00,tutor,tutor,14,,25.0,
,,,30.,2023-02-19T20:03:21.300+00:00,2023-02-19T20:03:22.920+00:00,tutor,tutor,14,,25.0,
,,,This is the right angle here. and then this one just can be 60 degrees,2023-02-19T20:03:23.320+00:00,2023-02-19T20:03:29.540+00:00,tutor,tutor,14,,25.0,
,,,"right so in 36 90, 30 is one. 6 decreases root 3, and the audiences too. and this is also in the formula sheet.",2023-02-19T20:03:31.260+00:00,2023-02-19T20:03:43.790+00:00,tutor,tutor,14,,25.0,
,,,If we go back to the test,2023-02-19T20:03:43.830+00:00,2023-02-19T20:03:45.990+00:00,tutor,tutor,14,,25.0,
,,,"leave. It does give you a formula, she on this one. but on the actual practice list it should.",2023-02-19T20:03:46.180+00:00,2023-02-19T20:03:52.950+00:00,tutor,tutor,14,,25.0,
,,,"Okay? Well, I can't see the test by it should have given a formula. Sheet and a 36 90 is on there.",2023-02-19T20:03:54.400+00:00,2023-02-19T20:03:59.540+00:00,tutor,tutor,14,,25.0,
,,,"so sign is opposite, or I pop news. S0 0pposite one I partners 2 so signed 30 degrees equals one half.",2023-02-19T20:04:00.180+00:00,2023-02-19T20:04:10.020+00:00,tutor,tutor,14,,25.0,
,,,We're trying to figure out,2023-02-19T20:04:11.040+00:00,2023-02-19T20:04:12.790+00:00,tutor,tutor,14,,25.0,
,,,what other,2023-02-19T20:04:12.820+00:00,2023-02-19T20:04:15.180+00:00,tutor,tutor,14,,25.0,
,,,the equation also gives us one half,2023-02-19T20:04:15.380+00:00,2023-02-19T20:04:18.080+00:00,tutor,tutor,14,,25.0,
,,,"so cosine of 90 degrees minus x is the correct answer. If we try that. Let's do co-signed up 30 degrees or cosine, of 90 minus 30 cosine.",2023-02-19T20:04:18.270+00:00,2023-02-19T20:04:31.160+00:00,tutor,tutor,14,,25.0,
,,,90 minus 30,2023-02-19T20:04:31.710+00:00,2023-02-19T20:04:33.690+00:00,tutor,tutor,14,,25.0,
,,,is the same thing as cosine of 60. Right?,2023-02-19T20:04:35.490+00:00,2023-02-19T20:04:38.330+00:00,tutor,tutor,14,,25.0,
,,,"So cosine of 60, adjacent, adjacent over a hypotenuse is",2023-02-19T20:04:39.280+00:00,2023-02-19T20:04:45.540+00:00,tutor,tutor,14,,25.0,
,,,one half. Are you guys,2023-02-19T20:04:46.890+00:00,2023-02-19T20:04:48.790+00:00,tutor,tutor,14,,25.0,
,,,So,2023-02-19T20:04:49.940+00:00,2023-02-19T20:04:51.000+00:00,tutor,tutor,14,,25.0,
,,,do you guys understand how that one works. Would anybody like to show me what they did or how they figured that one out? But that's basically how you know this,2023-02-19T20:04:51.730+00:00,2023-02-19T20:05:01.220+00:00,tutor,tutor,14,,25.0,
,,,cool.,2023-02-19T20:05:01.280+00:00,2023-02-19T20:05:01.980+00:00,tutor,tutor,14,,25.0,
,,,Okay.,2023-02-19T20:05:14.170+00:00,2023-02-19T20:05:14.960+00:00,tutor,tutor,14,,25.0,
,,1.0,So we're going to d0 0ne more and we will be done with the session today and pick up next week.,2023-02-19T20:05:16.630+00:00,2023-02-19T20:05:23.530+00:00,tutor,tutor,15,,,
,,,We did number 2. What's new,2023-02-19T20:05:25.690+00:00,2023-02-19T20:05:28.050+00:00,tutor,tutor,15,,,
,,,"number. Oh, yeah.",2023-02-19T20:05:30.280+00:00,2023-02-19T20:05:32.630+00:00,tutor,tutor,15,,,
,,,we could do. Number 10 Number 10 is a very popular question on the sat.,2023-02-19T20:05:33.100+00:00,2023-02-19T20:05:38.070+00:00,tutor,tutor,15,,,
,,,Okay.,2023-02-19T20:05:40.590+00:00,2023-02-19T20:05:41.300+00:00,tutor,tutor,15,,,
,34.0,1.0,So based on the graph about and how many of the games play that the soccer team score both equal to the medium number of goals for the 29 games.,2023-02-19T20:05:41.440+00:00,2023-02-19T20:05:50.220+00:00,tutor,tutor,16,,34.0,
,,,So,2023-02-19T20:05:50.610+00:00,2023-02-19T20:05:51.770+00:00,tutor,tutor,16,,34.0,
,,,"it's median. So median is half of the range well, not half of the range, but half of the total number of games in this case s0 29 divided by 2",2023-02-19T20:05:51.790+00:00,2023-02-19T20:06:05.390+00:00,tutor,tutor,16,,34.0,
,,,to erase this,2023-02-19T20:06:08.140+00:00,2023-02-19T20:06:09.530+00:00,tutor,tutor,16,,34.0,
,,,49 by 2,2023-02-19T20:06:10.980+00:00,2023-02-19T20:06:12.500+00:00,tutor,tutor,16,,34.0,
,,,"equals 14.5,",2023-02-19T20:06:12.540+00:00,2023-02-19T20:06:15.760+00:00,tutor,tutor,16,,34.0,
,,,or you g0 14 from each side to get to the middle.,2023-02-19T20:06:16.060+00:00,2023-02-19T20:06:19.570+00:00,tutor,tutor,16,,34.0,
,,,Okay. So,2023-02-19T20:06:23.110+00:00,2023-02-19T20:06:24.900+00:00,tutor,tutor,16,,34.0,
,,,"if we look here, this is 8 0f the games, and then this is 17 here to g012-34-5678, 91011121314151617. So here's the median at 2,",2023-02-19T20:06:25.030+00:00,2023-02-19T20:06:40.200+00:00,tutor,tutor,16,,34.0,
,,,right?,2023-02-19T20:06:40.590+00:00,2023-02-19T20:06:41.320+00:00,tutor,tutor,16,,34.0,
,,,"So we're gonna do. Here is figure out. This is our meeting, too. so based on the grab above. And how many of the games played in the school soccer team score goals equal to the media number of goals. That's why I games. Well, it's just 9,",2023-02-19T20:06:42.080+00:00,2023-02-19T20:06:57.300+00:00,tutor,tutor,16,,34.0,
,,,"because the meetings, too, we're trying to figure out how many of the games that the team score 2 goals or the media.",2023-02-19T20:06:57.960+00:00,2023-02-19T20:07:04.250+00:00,tutor,tutor,16,,34.0,
,,,and that was 9 games.,2023-02-19T20:07:04.410+00:00,2023-02-19T20:07:06.270+00:00,tutor,tutor,16,,34.0,
,,,"and we're actually going to g0 0ver one more problem. It's a circle, one up here. But if you guys understand how Number 34 works.",2023-02-19T20:07:08.180+00:00,2023-02-19T20:07:14.730+00:00,tutor,tutor,16,,34.0,
,,,But anybody like any explanation on that one.,2023-02-19T20:07:18.590+00:00,2023-02-19T20:07:20.960+00:00,tutor,tutor,16,,34.0,
,31.0,1.0,"Okay. looks like we have no question. So the last one to g0 0ver is number 31, and the Xy plane above the circle has center, Hk and radius 10.",2023-02-19T20:07:27.600+00:00,2023-02-19T20:07:38.950+00:00,tutor,tutor,17,,31.0,
