problem_set,question_id,time_segment,text,startTimestamp,endTimestamp,speaker,speaker_#,actual_segment,pred_segment,actual_question_id,pred_question_id
,,,What what is the poly? What is the value of K. Sorry.,2023-02-19T20:07:39.020+00:00,2023-02-19T20:07:42.650+00:00,tutor,tutor,17,,31.0,
,,,"So K. Is the origin of the not the origin of Circle, the center of the circle. The y value of this.",2023-02-19T20:07:43.830+00:00,2023-02-19T20:07:52.130+00:00,tutor,tutor,17,,31.0,
,,,So first we're going to have to figure out what the,2023-02-19T20:07:52.490+00:00,2023-02-19T20:07:56.890+00:00,tutor,tutor,17,,31.0,
,,,"h is, and then we can go up a. K.",2023-02-19T20:07:57.080+00:00,2023-02-19T20:08:00.030+00:00,tutor,tutor,17,,31.0,
,,,We're in place. So,2023-02-19T20:08:00.460+00:00,2023-02-19T20:08:04.200+00:00,tutor,tutor,17,,31.0,
,,,i'm gonna try this here. I don't want that,2023-02-19T20:08:06.100+00:00,2023-02-19T20:08:09.130+00:00,tutor,tutor,17,,31.0,
,,,here.,2023-02-19T20:08:13.090+00:00,2023-02-19T20:08:14.000+00:00,tutor,tutor,17,,31.0,
,,,"So here's our line here, and then here is that circle.",2023-02-19T20:08:14.380+00:00,2023-02-19T20:08:18.600+00:00,tutor,tutor,17,,31.0,
,,,"Oh, well.",2023-02-19T20:08:19.740+00:00,2023-02-19T20:08:20.520+00:00,tutor,tutor,17,,31.0,
,,,okay. So here's the center.,2023-02-19T20:08:25.190+00:00,2023-02-19T20:08:28.090+00:00,tutor,tutor,17,,31.0,
,,,This pretend this is the Hk.,2023-02-19T20:08:29.840+00:00,2023-02-19T20:08:32.570+00:00,tutor,tutor,17,,31.0,
,,,and then we have the coordinate here. I think it was like 4 0,2023-02-19T20:08:32.660+00:00,2023-02-19T20:08:37.100+00:00,tutor,tutor,17,,31.0,
,,,"yeah, 4 0 and 20. So let me give my little pan out here.",2023-02-19T20:08:37.280+00:00,2023-02-19T20:08:42.420+00:00,tutor,tutor,17,,31.0,
,,,Where is your and 20?,2023-02-19T20:08:44.250+00:00,2023-02-19T20:08:47.780+00:00,tutor,tutor,17,,31.0,
,,,I know that the radius is 10.,2023-02-19T20:08:48.260+00:00,2023-02-19T20:08:51.920+00:00,tutor,tutor,17,,31.0,
,,,So here is the radius. and,2023-02-19T20:08:53.200+00:00,2023-02-19T20:08:57.200+00:00,tutor,tutor,17,,31.0,
,,,"and I like to ask you guys, what do you think the side here is? You guys can take me into the chat, or you guys can just shout it out.",2023-02-19T20:08:57.620+00:00,2023-02-19T20:09:07.540+00:00,tutor,tutor,17,,31.0,
,,,"And also the sector link here the sector length here, 16.",2023-02-19T20:09:10.560+00:00,2023-02-19T20:09:14.580+00:00,tutor,tutor,17,,31.0,
,,,"So with that information, how you guys gonna to solve for the",2023-02-19T20:09:14.630+00:00,2023-02-19T20:09:18.710+00:00,tutor,tutor,17,,31.0,
,,,length of one of the triangle sides here,2023-02-19T20:09:18.760+00:00,2023-02-19T20:09:21.130+00:00,tutor,tutor,17,,31.0,
,,,12. So I believe this is actually,2023-02-19T20:09:27.270+00:00,2023-02-19T20:09:30.850+00:00,tutor,tutor,17,,31.0,
,,,"8, because 65 by 2 is 8. It's okay.",2023-02-19T20:09:31.490+00:00,2023-02-19T20:09:35.480+00:00,tutor,tutor,17,,31.0,
,,,"I understand how you got that, I think.",2023-02-19T20:09:37.580+00:00,2023-02-19T20:09:39.910+00:00,tutor,tutor,17,,31.0,
,,,Yeah.,2023-02-19T20:09:46.370+00:00,2023-02-19T20:09:47.100+00:00,tutor,tutor,17,,31.0,
,,,"But just yeah, 1692 is 8. And then this is the center length. You can d0 20 minus 4 equals 16,",2023-02-19T20:09:47.170+00:00,2023-02-19T20:09:55.390+00:00,tutor,tutor,17,,31.0,
,,,"and then that's the entire thing. 16 is. And then to find one half of this, you would just d0 8.",2023-02-19T20:09:55.780+00:00,2023-02-19T20:10:02.780+00:00,tutor,tutor,17,,31.0,
,,,So do you understand how I got that? You?,2023-02-19T20:10:05.090+00:00,2023-02-19T20:10:06.700+00:00,tutor,tutor,17,,31.0,
,,,It's really okay that you put that,2023-02-19T20:10:06.800+00:00,2023-02-19T20:10:08.970+00:00,tutor,tutor,17,,31.0,
,,,"does matter. You're here to learn, anyway.",2023-02-19T20:10:09.030+00:00,2023-02-19T20:10:11.510+00:00,tutor,tutor,17,,31.0,
,,,So this,2023-02-19T20:10:22.400+00:00,2023-02-19T20:10:23.910+00:00,tutor,tutor,17,,31.0,
,,,"is actually 3 4 5, right triangle, because we know that this one would be a right angle whenever we draw from the perpendicular. I guess Bisector here",2023-02-19T20:10:23.940+00:00,2023-02-19T20:10:33.810+00:00,tutor,tutor,17,,31.0,
,,,it would make a right angle here.,2023-02-19T20:10:34.940+00:00,2023-02-19T20:10:37.130+00:00,tutor,tutor,17,,31.0,
,,,So,2023-02-19T20:10:37.540+00:00,2023-02-19T20:10:39.250+00:00,tutor,tutor,17,,31.0,
,,,"this is a 3 4, 5, right triangle, and then multiply by 2. So it's a 10, 8 6,",2023-02-19T20:10:39.270+00:00,2023-02-19T20:10:48.260+00:00,tutor,tutor,17,,31.0,
,,,6 here.,2023-02-19T20:10:49.020+00:00,2023-02-19T20:10:50.490+00:00,tutor,tutor,17,,31.0,
,,,and we could. I think it was H. K. What the center.,2023-02-19T20:10:50.980+00:00,2023-02-19T20:10:54.170+00:00,tutor,tutor,17,,31.0,
,,,and we're trying to find what K. Is.,2023-02-19T20:10:54.890+00:00,2023-02-19T20:10:56.620+00:00,tutor,tutor,17,,31.0,
,,,"and K. Was 6, because that is the value of the origin",2023-02-19T20:10:56.960+00:00,2023-02-19T20:11:03.930+00:00,tutor,tutor,17,,31.0,
,,,"here, and then this is the other. This the why",2023-02-19T20:11:04.820+00:00,2023-02-19T20:11:07.250+00:00,tutor,tutor,17,,31.0,
,,,access that that's access?,2023-02-19T20:11:10.660+00:00,2023-02-19T20:11:12.320+00:00,tutor,tutor,17,,31.0,
,,,"It's all about Jackie. Thank you for coming today, and I hope you've learned something today, and i'm glad you guys",2023-02-19T20:11:16.970+00:00,2023-02-19T20:11:23.110+00:00,tutor,tutor,17,,31.0,
,,,okay today.,2023-02-19T20:11:23.340+00:00,2023-02-19T20:11:24.250+00:00,tutor,tutor,17,,31.0,
,,,Any,2023-02-19T20:11:24.640+00:00,2023-02-19T20:11:26.280+00:00,tutor,tutor,17,,31.0,
,,,see a Jackie? How did you solve the problem?,2023-02-19T20:11:27.590+00:00,2023-02-19T20:11:30.330+00:00,tutor,tutor,17,,31.0,
,,,And i'll actually let you guys annotate.,2023-02-19T20:11:31.230+00:00,2023-02-19T20:11:33.960+00:00,tutor,tutor,17,,31.0,
,,,I'll go pull the whiteboard for you guys.,2023-02-19T20:11:34.180+00:00,2023-02-19T20:11:36.750+00:00,tutor,tutor,17,,31.0,
,,,Let me stop this year. I think there is a way for me to pull up the whiteboard. You guys. Okay?,2023-02-19T20:11:38.000+00:00,2023-02-19T20:11:42.350+00:00,tutor,tutor,17,,31.0,
,,,So any you can actually type in like how you did this.,2023-02-19T20:11:47.250+00:00,2023-02-19T20:11:52.240+00:00,tutor,tutor,17,,31.0,
,,,There should be an annotate tool at the top of your screen.,2023-02-19T20:11:52.570+00:00,2023-02-19T20:11:54.840+00:00,tutor,tutor,17,,31.0,
,,,just like show everybody else how you this.,2023-02-19T20:11:57.990+00:00,2023-02-19T20:12:00.020+00:00,tutor,tutor,17,,31.0,
,,,I still don't see how. My,2023-02-19T20:12:04.830+00:00,2023-02-19T20:12:06.870+00:00,student,student D,17,,31.0,
,,,"Oh, you don't have a",2023-02-19T20:12:07.470+00:00,2023-02-19T20:12:08.930+00:00,tutor,tutor,17,,31.0,
,,,huh?,2023-02-19T20:12:12.540+00:00,2023-02-19T20:12:13.260+00:00,tutor,tutor,17,,31.0,
,,,I just use the equation of a circle.,2023-02-19T20:12:15.140+00:00,2023-02-19T20:12:17.820+00:00,student,student D,17,,31.0,
,,,"Okay, so like X minus h squared plus 5 minus K squared equals r squared.",2023-02-19T20:12:19.060+00:00,2023-02-19T20:12:25.590+00:00,tutor,tutor,17,,31.0,
,,,"Yeah, that's what I did.",2023-02-19T20:12:25.770+00:00,2023-02-19T20:12:28.790+00:00,student,student D,17,,31.0,
,,,That was 12.,2023-02-19T20:12:29.220+00:00,2023-02-19T20:12:31.790+00:00,student,student D,17,,31.0,
,,,"Yeah. Oh, so you like plug in the values when you found that one.",2023-02-19T20:12:31.980+00:00,2023-02-19T20:12:35.170+00:00,tutor,tutor,17,,31.0,
,,,Yeah.,2023-02-19T20:12:35.640+00:00,2023-02-19T20:12:36.540+00:00,student,student D,17,,31.0,
,,,Okay. So,2023-02-19T20:12:36.610+00:00,2023-02-19T20:12:39.180+00:00,student,student D,17,,31.0,
,,,"yeah, that's a that's a good way to think about it as well. So since we have one of the coordinates on the circle for 0, and then we have the center H. K.",2023-02-19T20:12:40.980+00:00,2023-02-19T20:12:52.480+00:00,tutor,tutor,17,,31.0,
,,,And then we have the equation for Circle X minus h squared. plus y minus k squared equals,2023-02-19T20:12:52.520+00:00,2023-02-19T20:13:03.680+00:00,tutor,tutor,17,,31.0,
,,,10.,2023-02-19T20:13:03.850+00:00,2023-02-19T20:13:04.680+00:00,tutor,tutor,17,,31.0,
,,,We start playing in the values,2023-02-19T20:13:06.280+00:00,2023-02-19T20:13:08.380+00:00,tutor,tutor,17,,31.0,
,,,X: Sorry X.,2023-02-19T20:13:09.840+00:00,2023-02-19T20:13:11.930+00:00,tutor,tutor,17,,31.0,
,,,It's going to be,2023-02-19T20:13:12.810+00:00,2023-02-19T20:13:14.080+00:00,tutor,tutor,17,,31.0,
,,,4,2023-02-19T20:13:16.660+00:00,2023-02-19T20:13:17.560+00:00,tutor,tutor,17,,31.0,
,,,"minus h squared. plus. This is 10 square. And oh, you guys can't see the screen. Sorry about that. Let me go. We'll just help on you guys.",2023-02-19T20:13:20.610+00:00,2023-02-19T20:13:34.440+00:00,tutor,tutor,17,,31.0,
,,,I'm share.,2023-02-19T20:13:36.240+00:00,2023-02-19T20:13:37.440+00:00,tutor,tutor,17,,31.0,
,,,Okay.,2023-02-19T20:13:37.820+00:00,2023-02-19T20:13:38.480+00:00,tutor,tutor,17,,31.0,
,,,like I should be able to see that.,2023-02-19T20:13:39.500+00:00,2023-02-19T20:13:41.270+00:00,tutor,tutor,17,,31.0,
,,,And then this was 0 minus K squared,2023-02-19T20:13:43.320+00:00,2023-02-19T20:13:47.650+00:00,tutor,tutor,17,,31.0,
,,,equals 10 squared.,2023-02-19T20:13:47.880+00:00,2023-02-19T20:13:49.470+00:00,tutor,tutor,17,,31.0,
,,,This should actually be up here.,2023-02-19T20:13:49.830+00:00,2023-02-19T20:13:51.870+00:00,tutor,tutor,17,,31.0,
,,,and then what we need.,2023-02-19T20:13:52.670+00:00,2023-02-19T20:13:55.440+00:00,tutor,tutor,17,,31.0,
,,,So since that's a 0 0 minus K squared. You just have It's up with Case gradually up here. So then 16 minus,2023-02-19T20:13:56.860+00:00,2023-02-19T20:14:09.240+00:00,tutor,tutor,17,,31.0,
,,,"yeah, 8 h",2023-02-19T20:14:10.200+00:00,2023-02-19T20:14:12.430+00:00,tutor,tutor,17,,31.0,
,,,minus h squared.,2023-02-19T20:14:12.980+00:00,2023-02-19T20:14:14.780+00:00,tutor,tutor,17,,31.0,
,,,and this is plus k squared. It was one hydrating. and then we have 2 unknowns here. But we figured out that H.,2023-02-19T20:14:16.030+00:00,2023-02-19T20:14:25.590+00:00,tutor,tutor,17,,31.0,
,,,"Was 8, I believe.",2023-02-19T20:14:25.610+00:00,2023-02-19T20:14:28.670+00:00,tutor,tutor,17,,31.0,
,,,"which is something else or no, it was 12. Hs. 12. That's a",2023-02-19T20:14:28.950+00:00,2023-02-19T20:14:35.260+00:00,tutor,tutor,17,,31.0,
,,,that. Because,2023-02-19T20:14:35.360+00:00,2023-02-19T20:14:36.690+00:00,tutor,tutor,17,,31.0,
,,,4 plus 8 is 12.,2023-02-19T20:14:36.720+00:00,2023-02-19T20:14:39.220+00:00,tutor,tutor,17,,31.0,
,,,"Yeah, she cooled up. Yeah, so",2023-02-19T20:14:39.520+00:00,2023-02-19T20:14:41.810+00:00,tutor,tutor,17,,31.0,
,,,16 divided by 2 is 8 0r plus 8 is,2023-02-19T20:14:42.410+00:00,2023-02-19T20:14:47.040+00:00,tutor,tutor,17,,31.0,
,,,12.,2023-02-19T20:14:47.090+00:00,2023-02-19T20:14:48.270+00:00,tutor,tutor,17,,31.0,
,,,"They plug in 16. It's 8 times 12,",2023-02-19T20:14:49.830+00:00,2023-02-19T20:14:53.710+00:00,tutor,tutor,17,,31.0,
,,,minus 12 squared.,2023-02-19T20:14:53.830+00:00,2023-02-19T20:14:56.060+00:00,tutor,tutor,17,,31.0,
,,,and then plus k squared equals 100,2023-02-19T20:14:57.370+00:00,2023-02-19T20:15:01.080+00:00,tutor,tutor,17,,31.0,
,,,"16 minus 96, yeah.",2023-02-19T20:15:01.430+00:00,2023-02-19T20:15:05.440+00:00,tutor,tutor,17,,31.0,
,,,"and minus 144 plus case, where it is 100.",2023-02-19T20:15:05.520+00:00,2023-02-19T20:15:11.030+00:00,tutor,tutor,17,,31.0,
,,,"It's all of our calculators, 100 minus 16 plus 96 plus 144,",2023-02-19T20:15:11.240+00:00,2023-02-19T20:15:18.110+00:00,tutor,tutor,17,,31.0,
,,,and the square with that is 18.,2023-02-19T20:15:18.170+00:00,2023-02-19T20:15:21.240+00:00,tutor,tutor,17,,31.0,
,,,I'm gonna put in something wrong. Any. Is this how you solved it or,2023-02-19T20:15:22.810+00:00,2023-02-19T20:15:26.150+00:00,tutor,tutor,17,,31.0,
,,,was it doing something wrong with it.,2023-02-19T20:15:27.080+00:00,2023-02-19T20:15:29.440+00:00,tutor,tutor,17,,31.0,
,,,I didn't solve it like that.,2023-02-19T20:15:30.160+00:00,2023-02-19T20:15:32.330+00:00,student,student D,17,,31.0,
,,,"Oh, how did you solve it?",2023-02-19T20:15:32.780+00:00,2023-02-19T20:15:35.040+00:00,student,student D,17,,31.0,
,,,I'll just do that there.,2023-02-19T20:15:40.200+00:00,2023-02-19T20:15:41.610+00:00,student,student D,17,,31.0,
,,,Well.,2023-02-19T20:15:43.060+00:00,2023-02-19T20:15:44.060+00:00,student,student D,17,,31.0,
,,,"I found H. I just added 20 plus 4, and divided that by 2 to get 12.",2023-02-19T20:15:46.070+00:00,2023-02-19T20:15:51.420+00:00,student,student D,17,,31.0,
,,,0 0kay. Because if it's like the,2023-02-19T20:15:51.830+00:00,2023-02-19T20:15:55.670+00:00,student,student D,17,,31.0,
,,,center of the circle.,2023-02-19T20:15:56.670+00:00,2023-02-19T20:15:58.080+00:00,student,student D,17,,31.0,
,,,then half of the way across would have to be,2023-02-19T20:15:59.490+00:00,2023-02-19T20:16:02.380+00:00,student,student D,17,,31.0,
,,,would have to meet to the middle because it was in the center. So yeah. So I just did that to find the diameter.,2023-02-19T20:16:04.970+00:00,2023-02-19T20:16:10.320+00:00,student,student D,17,,31.0,
,,,"0 0kay, see what you say. We're just saying now.",2023-02-19T20:16:10.970+00:00,2023-02-19T20:16:14.030+00:00,tutor,tutor,17,,31.0,
,,,"So like the sector length is 12, and then you divide the secure link in half to get the height of the circle.",2023-02-19T20:16:14.150+00:00,2023-02-19T20:16:21.640+00:00,tutor,tutor,17,,31.0,
,,,Yeah. So I did that.,2023-02-19T20:16:22.750+00:00,2023-02-19T20:16:24.390+00:00,student,student D,17,,31.0,
,,,Okay.,2023-02-19T20:16:25.150+00:00,2023-02-19T20:16:26.060+00:00,tutor,tutor,17,,31.0,
,,,"Yeah, that was a good way of thinking of it. But I think the best way to do it like that. That was very intuitive, and I like that. You solved it that way. But the best way to solve it was the way I did, I think, because",2023-02-19T20:16:26.600+00:00,2023-02-19T20:16:39.580+00:00,tutor,tutor,17,,31.0,
,,,"it's a little bit more reliable. I don't know if that's always how it would be able to solve it, because.",2023-02-19T20:16:39.990+00:00,2023-02-19T20:16:45.780+00:00,tutor,tutor,17,,31.0,
,,,"for example. if the circle is shifted, maybe 2 units up. That would no longer work.",2023-02-19T20:16:45.930+00:00,2023-02-19T20:16:52.140+00:00,tutor,tutor,17,,31.0,
,,,because then the sector would be what like,2023-02-19T20:16:54.040+00:00,2023-02-19T20:16:57.120+00:00,tutor,tutor,17,,31.0,
,,,"instead of 12 would be 8, and then 8 5 by 2 would give you 4, and that wouldn't give you the link up here. So",2023-02-19T20:16:58.650+00:00,2023-02-19T20:17:06.340+00:00,tutor,tutor,17,,31.0,
,,,"just remember, whenever you have these, you can just think of the hypotenuse as you radius from that point to the x-axis, or at that point. And then you would have the sector here, which is 16 and the highlight 2, and then the 3 4 5 to get 6 8, and",2023-02-19T20:17:06.470+00:00,2023-02-19T20:17:23.980+00:00,tutor,tutor,17,,31.0,
,,,so does everybody understand how I did that?,2023-02-19T20:17:25.860+00:00,2023-02-19T20:17:28.020+00:00,tutor,tutor,17,,31.0,
,,,"And if that works you can continue using that method you need. but i'd recommend you, maybe start using this one as well in case like you want to check your answer. You have time.",2023-02-19T20:17:34.780+00:00,2023-02-19T20:17:47.700+00:00,tutor,tutor,17,,31.0,
,,,"But if you just works my only answer, okay.",2023-02-19T20:17:49.900+00:00,2023-02-19T20:17:52.230+00:00,tutor,tutor,17,,31.0,
,,,"Oh, sorry. We're going to say some",2023-02-19T20:17:56.360+00:00,2023-02-19T20:17:57.710+00:00,tutor,tutor,17,,31.0,
,,,"Yeah, mine works, though.",2023-02-19T20:18:00.130+00:00,2023-02-19T20:18:02.320+00:00,student,student D,17,,31.0,
,,,"Yeah, I was.",2023-02-19T20:18:02.380+00:00,2023-02-19T20:18:03.350+00:00,tutor,tutor,17,,31.0,
,,,I see what you're saying.,2023-02-19T20:18:03.440+00:00,2023-02-19T20:18:04.820+00:00,student,student D,17,,31.0,
,,,"Yeah. I mean, if it works, that's totally okay. And you can continue using it. And if you let me check your answer, using the way that I have.",2023-02-19T20:18:04.940+00:00,2023-02-19T20:18:13.870+00:00,tutor,tutor,17,,31.0,
,,1.0,"So that's going to conclude this session today, and I we're 20 min over. But this was one of the harder practice that. So it's okay that we went to lift it over. Sorry about that guys.",2023-02-19T20:18:15.780+00:00,2023-02-19T20:18:28.180+00:00,tutor,tutor,18,,,
,,,"But yeah, that's all we have today. If anybody would like to stay and ask any more questions you can. Otherwise that will be the end of the session. Thank you for coming today.",2023-02-19T20:18:28.540+00:00,2023-02-19T20:18:37.810+00:00,tutor,tutor,18,,,
,,,Bye. Thank you.,2023-02-19T20:18:39.120+00:00,2023-02-19T20:18:42.400+00:00,student,student E,18,,,
,,,Yeah.,2023-02-19T20:18:42.940+00:00,2023-02-19T20:18:43.690+00:00,tutor,tutor,18,,,
,,,All right. That.,2023-02-19T20:18:46.060+00:00,2023-02-19T20:18:47.270+00:00,tutor,tutor,18,,,
